id,company_id,"title","text","qr_link"
1,6,"PHP Backend developer","Hladame typka na php backend si to ty?",NULL
2,6,"JAVA developer","chces sa pridat do nasho tymu?",NULL
3,6,"Predavac drahych aut","Si komunikativny? tu je text k tomuto inzeratu",NULL
4,6,"Dokladac tovaru v kauflande","ponukame pracu na dohodu, 4eura brutto hodina.",NULL
6,6,"Grand Prix Brno usporiadatel","Hladame typka na trat k motorkam",NULL
15,6,"Junior PHP developer","Hladame junior PHP developera .","/assets/images/qr_codes/job_qr/job15.png"
